{
  "engagementId": "example-workshop",
  "mode": "mode-1-opencode-orchestrates",
  "startsAt": "2000-01-01T00:00:00Z",
  "endsAt": "2000-01-02T00:00:00Z",
  "targets": [],
  "osintSources": [],
  "categories": [],
  "accounts": [],
  "teamIdentity": "workshop-team",
  "prohibitedActions": ["real secret exfiltration", "persistence", "denial of service", "third-party impact"],
  "koth": {
    "allowPatchApplication": false,
    "allowFlagSubmission": false,
    "submissionEndpoints": []
  },
  "evidenceLevel": "workshop"
}
